{
  "reviewer": "coordinador con revisión independiente monorepo_review",
  "reviewed_at": "2026-10-31T04:43:01.000Z",
  "summary": "Modelo de apps monorepo y releases independientes documentado, distribuido y descubrible, sin migrar consumidores ni modificar sus autoridades de documentación, SQL o infraestructura. Revisión independiente sin bloqueantes; la falta previa de curl en imagen se corrigió y se revalidó el setup.",
  "validation": [
    {
      "command": "Cobertura integrada de 26 suites: run-validation.sh --with-lint y reejecución focalizada de las tres suites de setup en imagen completada",
      "outcome": "passed",
      "evidence": "verification.md y evidence/validation.log + evidence/setup-recheck.log detallan el fallo inicial de prerrequisito, su corrección y la cobertura final aprobada."
    },
    {
      "command": "node tooling/validate-framework.mjs con VALIDATION_CHANGED_FILES_PATH",
      "outcome": "passed",
      "evidence": "evidence/source-validation.log: estructura, routing, guías, links, contratos, VERSION e higiene aprobados."
    },
    {
      "command": "node tooling/harness-assurance.mjs --root /workspace --scope security",
      "outcome": "passed",
      "evidence": "evidence/secret-scan.log: Gitleaks 8.30.1 real, archivos e índice sin hallazgos."
    }
  ],
  "sources": [
    "docs/architecture/consumer-contract.md",
    "docs/governance/versioning.md",
    "docs/roadmap/README.md",
    "docs/roadmap/backlog.md",
    ".harness_work/memory/current.md"
  ]
}
