{
  "reviewer": "coordinador con revisión funcional independiente de audit_infra",
  "reviewed_at": "2026-10-29T04:30:26.824Z",
  "summary": "Auditoría completa de proporcionalidad, contratos de bases de datos e infraestructura; contradicciones evidentes y huella de entrega corregidas, guías reconciliadas y decisiones operativas pendientes preservadas sin inventar requisitos.",
  "validation": [
    {
      "command": "bash tooling/run-validation.sh --with-lint",
      "outcome": "passed",
      "evidence": "Node.js 24.18.0 nativo; exit 0; validación estructural, lint y dieciocho suites. evidence/native-node24.log. Sin pruebas de producto, SQL, deploy ni proveedores reales."
    },
    {
      "command": "Revisión independiente de contratos y fix de huella",
      "outcome": "passed",
      "evidence": "reviews/final-review.md; sin bloqueantes confirmados, corrección inspeccionada por revisor distinto del implementador."
    }
  ],
  "sources": [
    "docs/architecture/agent-execution.md",
    "docs/governance/pending-decisions.md",
    "docs/governance/decisions/0009-proportional-spec-workflow.md",
    "docs/governance/transformations/2026-09-09-skills-reconciliation.md",
    ".harness_work/memory/current.md"
  ]
}
